{
  "schemaVersion": "controller-bundle.proposal.v2",
  "proposalStatus": "BLOCKED_UNMATERIALIZED",
  "sourceRepository": "Krowaccie/AppWriteWork",
  "sourceRepositoryRevision": "UNMATERIALIZED",
  "controllerRepository": "Krowaccie/AppWriteWork-verification-control",
  "controllerRevision": "UNMATERIALIZED",
  "seedSourceSets": {
    "schemaVersion": "controller-seed-source-sets-reference.v1",
    "path": "packages/verification-controller/controller-seed-source-sets.v1.json",
    "schemaPath": "dev/verification/schemas/controller-seed-source-sets.v1.schema.json"
  },
  "entrypoints": [
    {
      "path": "packages/verification-controller/src/collect-appwrite-test-readback.mjs",
      "sha256": "UNMATERIALIZED"
    },
    {
      "path": "packages/verification-controller/src/controller-bundle-publisher.mjs",
      "sha256": "UNMATERIALIZED"
    },
    {
      "path": "packages/verification-controller/src/controller-runner-qualification-cli.mjs",
      "sha256": "UNMATERIALIZED"
    },
    {
      "path": "packages/verification-controller/src/create-production-browser-policy.mjs",
      "sha256": "UNMATERIALIZED"
    },
    {
      "path": "packages/verification-controller/src/create-verified-release-record-handoff.mjs",
      "sha256": "UNMATERIALIZED"
    },
    {
      "path": "packages/verification-controller/src/release-production.mjs",
      "sha256": "UNMATERIALIZED"
    },
    {
      "path": "packages/verification-controller/src/run-production-readonly-playwright.mjs",
      "sha256": "UNMATERIALIZED"
    },
    {
      "path": "packages/verification-controller/src/test-cloud-binding-artifact-verifier.mjs",
      "sha256": "UNMATERIALIZED"
    },
    {
      "path": "packages/verification-controller/src/test-cloud-controller.mjs",
      "sha256": "UNMATERIALIZED"
    },
    {
      "path": "packages/verification-controller/workflows/collect-appwrite-test-readback.yml",
      "sha256": "UNMATERIALIZED"
    },
    {
      "path": "packages/verification-controller/workflows/production-readonly.yml",
      "sha256": "UNMATERIALIZED"
    },
    {
      "path": "packages/verification-controller/workflows/publish-controller-bundle.yml",
      "sha256": "UNMATERIALIZED"
    },
    {
      "path": "packages/verification-controller/workflows/release-production.yml",
      "sha256": "UNMATERIALIZED"
    },
    {
      "path": "packages/verification-controller/workflows/verify-test-cloud.yml",
      "sha256": "UNMATERIALIZED"
    }
  ],
  "files": [
    {
      "path": "dev/verification/bootstrap/qualify-runner.mjs",
      "sha256": "UNMATERIALIZED"
    },
    {
      "path": "dev/verification/environments/production.inventory.v1.json",
      "sha256": "UNMATERIALIZED"
    },
    {
      "path": "dev/verification/environments/test-cloud.inventory.v1.json",
      "sha256": "UNMATERIALIZED"
    },
    {
      "path": "packages/verification-controller/controller-bundle.proposal.json",
      "sha256": "UNMATERIALIZED"
    },
    {
      "path": "packages/verification-controller/controller-seed-source-sets.v1.json",
      "sha256": "UNMATERIALIZED"
    },
    {
      "path": "packages/verification-controller/e2e/production-readonly.spec.mjs",
      "sha256": "UNMATERIALIZED"
    },
    {
      "path": "packages/verification-controller/package-lock.json",
      "sha256": "UNMATERIALIZED"
    },
    {
      "path": "packages/verification-controller/package.json",
      "sha256": "UNMATERIALIZED"
    },
    {
      "path": "packages/verification-controller/playwright.config.mjs",
      "sha256": "UNMATERIALIZED"
    },
    {
      "path": "packages/verification-controller/src/appwrite-test-browser-policy.mjs",
      "sha256": "UNMATERIALIZED"
    },
    {
      "path": "packages/verification-controller/src/appwrite-test-live-readback.mjs",
      "sha256": "UNMATERIALIZED"
    },
    {
      "path": "packages/verification-controller/src/appwrite-test-setup-bindings.mjs",
      "sha256": "UNMATERIALIZED"
    },
    {
      "path": "packages/verification-controller/src/collect-appwrite-test-readback.mjs",
      "sha256": "UNMATERIALIZED"
    },
    {
      "path": "packages/verification-controller/src/controller-archive-verifier.mjs",
      "sha256": "UNMATERIALIZED"
    },
    {
      "path": "packages/verification-controller/src/controller-bundle-publisher.mjs",
      "sha256": "UNMATERIALIZED"
    },
    {
      "path": "packages/verification-controller/src/controller-runner-qualification-cli.mjs",
      "sha256": "UNMATERIALIZED"
    },
    {
      "path": "packages/verification-controller/src/create-production-browser-policy.mjs",
      "sha256": "UNMATERIALIZED"
    },
    {
      "path": "packages/verification-controller/src/create-verified-release-record-handoff.mjs",
      "sha256": "UNMATERIALIZED"
    },
    {
      "path": "packages/verification-controller/src/exact-sha-controller-source.mjs",
      "sha256": "UNMATERIALIZED"
    },
    {
      "path": "packages/verification-controller/src/github-controller-artifact-verifier.mjs",
      "sha256": "UNMATERIALIZED"
    },
    {
      "path": "packages/verification-controller/src/github-deployment-reader.mjs",
      "sha256": "UNMATERIALIZED"
    },
    {
      "path": "packages/verification-controller/src/github-deployment-writer.mjs",
      "sha256": "UNMATERIALIZED"
    },
    {
      "path": "packages/verification-controller/src/github-production-readonly-transport.mjs",
      "sha256": "UNMATERIALIZED"
    },
    {
      "path": "packages/verification-controller/src/production-exact-sha-git-adapter.mjs",
      "sha256": "UNMATERIALIZED"
    },
    {
      "path": "packages/verification-controller/src/production-readonly-adapter.mjs",
      "sha256": "UNMATERIALIZED"
    },
    {
      "path": "packages/verification-controller/src/production-readonly-appwrite.mjs",
      "sha256": "UNMATERIALIZED"
    },
    {
      "path": "packages/verification-controller/src/production-readonly-browser.mjs",
      "sha256": "UNMATERIALIZED"
    },
    {
      "path": "packages/verification-controller/src/production-readonly-environment.mjs",
      "sha256": "UNMATERIALIZED"
    },
    {
      "path": "packages/verification-controller/src/production-readonly-http.mjs",
      "sha256": "UNMATERIALIZED"
    },
    {
      "path": "packages/verification-controller/src/production-readonly-lane.mjs",
      "sha256": "UNMATERIALIZED"
    },
    {
      "path": "packages/verification-controller/src/production-release-appwrite.mjs",
      "sha256": "UNMATERIALIZED"
    },
    {
      "path": "packages/verification-controller/src/production-release-environment.mjs",
      "sha256": "UNMATERIALIZED"
    },
    {
      "path": "packages/verification-controller/src/production-release-executor.mjs",
      "sha256": "UNMATERIALIZED"
    },
    {
      "path": "packages/verification-controller/src/release-production.mjs",
      "sha256": "UNMATERIALIZED"
    },
    {
      "path": "packages/verification-controller/src/release-record-contract.mjs",
      "sha256": "UNMATERIALIZED"
    },
    {
      "path": "packages/verification-controller/src/run-production-readonly-playwright.mjs",
      "sha256": "UNMATERIALIZED"
    },
    {
      "path": "packages/verification-controller/src/source-artifact-reader.mjs",
      "sha256": "UNMATERIALIZED"
    },
    {
      "path": "packages/verification-controller/src/test-cloud-binding-artifact-verifier.mjs",
      "sha256": "UNMATERIALIZED"
    },
    {
      "path": "packages/verification-controller/src/test-cloud-browser-artifact-set.mjs",
      "sha256": "UNMATERIALIZED"
    },
    {
      "path": "packages/verification-controller/src/test-cloud-browser-route-adapter.mjs",
      "sha256": "UNMATERIALIZED"
    },
    {
      "path": "packages/verification-controller/src/test-cloud-contained-browser-scenario-adapter.mjs",
      "sha256": "UNMATERIALIZED"
    },
    {
      "path": "packages/verification-controller/src/test-cloud-contained-scenario-launcher.mjs",
      "sha256": "UNMATERIALIZED"
    },
    {
      "path": "packages/verification-controller/src/test-cloud-controller.mjs",
      "sha256": "UNMATERIALIZED"
    },
    {
      "path": "packages/verification-controller/src/test-cloud-fixture-clock.mjs",
      "sha256": "UNMATERIALIZED"
    },
    {
      "path": "packages/verification-controller/src/test-cloud-playwright-facade.mjs",
      "sha256": "UNMATERIALIZED"
    },
    {
      "path": "packages/verification-controller/src/test-cloud-scenario-driver.mjs",
      "sha256": "UNMATERIALIZED"
    },
    {
      "path": "packages/verification-controller/src/verified-production-handoff.mjs",
      "sha256": "UNMATERIALIZED"
    },
    {
      "path": "packages/verification-controller/src/verified-release-record-handoff.mjs",
      "sha256": "UNMATERIALIZED"
    },
    {
      "path": "packages/verification-controller/src/verify-production-browser-policy.mjs",
      "sha256": "UNMATERIALIZED"
    },
    {
      "path": "packages/verification-controller/workflows/collect-appwrite-test-readback.yml",
      "sha256": "UNMATERIALIZED"
    },
    {
      "path": "packages/verification-controller/workflows/production-readonly.yml",
      "sha256": "UNMATERIALIZED"
    },
    {
      "path": "packages/verification-controller/workflows/publish-controller-bundle.yml",
      "sha256": "UNMATERIALIZED"
    },
    {
      "path": "packages/verification-controller/workflows/release-production.yml",
      "sha256": "UNMATERIALIZED"
    },
    {
      "path": "packages/verification-controller/workflows/verify-test-cloud.yml",
      "sha256": "UNMATERIALIZED"
    },
    {
      "path": "scripts/verification/a1-supervisor-proposal.mjs",
      "sha256": "UNMATERIALIZED"
    },
    {
      "path": "scripts/verification/artifact-manifest.mjs",
      "sha256": "UNMATERIALIZED"
    },
    {
      "path": "scripts/verification/canonical-json.mjs",
      "sha256": "UNMATERIALIZED"
    },
    {
      "path": "scripts/verification/controller-bundle.mjs",